{
  "schema_version": "shared-pa-experiment-registry-policy-v1",
  "registry_id": "shared_pa_experiment_registry_v1",
  "status": "LOCKED_RESEARCH_ONLY_REGISTRY_WITH_SYNTHETIC_EVALUATOR",
  "authority_state": "UNBOUND_EXTERNAL_TRUST_REQUIRED",
  "source_base_commit": "9f9d839187550f7a7a6da3b4bfdb25b2dff3e794",
  "root_parent_candidate_id": "frozen_shared_pa_foundation",
  "canonical_evidence_window_ids": ["development_2023_only"],
  "markets": {
    "names": ["hits", "hr_over_0_5", "total_bases"],
    "adjudicate_separately": true,
    "pooling_allowed": false,
    "cross_market_rescue_allowed": false
  },
  "selection_authority": {
    "authority_id": "shared_pa_2024_selection_authority_v1",
    "window_id": "2024_regular_season",
    "window_state": "INELIGIBLE_ALREADY_SPENT",
    "issuance_enabled": false,
    "initial_issuance_state": "UNISSUED",
    "initial_consumption_state": "UNCONSUMED",
    "maximum_issues": 1,
    "maximum_consumptions": 1,
    "human_approval_required": true
  },
  "protected_boundaries": {
    "may_2026_sealed": true,
    "spent_2025_hr_confirmation_reusable": false,
    "historical_prices_executable": false,
    "missed_prospective_backfill_allowed": false,
    "market_pooling_allowed": false,
    "cross_market_rescue_allowed": false,
    "frozen_baselines_mutable": false,
    "betting_authorized": false
  },
  "artifact_rules": {
    "all_paths_relative_to_artifact_root": true,
    "all_bytes_sha256_bound": true,
    "symlink_and_reparse_points_forbidden": true,
    "artifact_reverification_required_on_replay": true,
    "output_namespace_part_of_governance_not_equivalence": true,
    "output_namespace_globally_unique": true,
    "semantic_design_independent_of_json_python_reserialization": true,
    "external_authority_required_for_authoritative_append": true
  },
  "evaluator_binding": {
    "path": "config/shared_pa_market_evaluation_contract_v1.json",
    "sha256": "53673c56b90e48d593c4355e0fb2c6152e69dbf165c15125db065d9059b5b34d",
    "file_manifest_path": "config/shared_pa_market_evaluator_v1_file_manifest.json",
    "file_manifest_sha256": "83cf0ca50a67f7f3c905d2f2cf189045ba9983ad5fc4a5718682a0b79cd7eec1",
    "state": "IMPLEMENTED_SYNTHETIC_ONLY_EXTERNALLY_UNBOUND",
    "evidence_class": "SYNTHETIC_STRUCTURAL_MECHANICS_ONLY",
    "external_authority_required_before_real_evaluation": true,
    "real_evaluation_authorized": false,
    "model_fitting_authorized": false,
    "promotion_authorized": false
  },
  "external_checkpoint_rule": {
    "authoritative_replay_requires_trusted_checkpoint": true,
    "local_chain_cannot_detect_wholesale_suffix_rollback": true,
    "fixed_canonical_path_required": true,
    "independent_expected_digest_required": true,
    "monotonic_sequence_required": true,
    "trusted_append_receipt_required": true
  }
}
